{
  "$schema": "https://json-schema.org/draft/2020-12/schema",
  "$id": "https://cosmobox.local/schemas/level3-s5-campaign-summary-v1.schema.json",
  "title": "Cosmobox Level3 S5 campaign summary (v1)",
  "description": "The Level3 S5 campaign-level finalization marker: for each of the three geometries, the S4<->S5 primary taxonomy and continuous descriptors for M_TT/R_eff, the four-spin (S2,S3,S4,S5) directional sequence with REVERSAL_COUNT_2345, and a descriptive-only S2/S3/S4/S5 comparison for the control metrics. delta_hl_s2/direction_s2/c_x_23-derived data are read from the frozen Level2 reference; delta_hl_s4/direction_s4/t_x_34/c_x_34/d_x_34 are read from the frozen Level3 S4 reference -- neither is ever recomputed. This document is written ONLY when the campaign is fully complete (3/3 S5 cases, 3/3 geometry comparisons, same repository_commit/manifest_fingerprint/campaign_id, all cases full-spectrum with zero partial subspaces, both frozen references verified): its mere existence on disk is the completeness marker.",
  "type": "object",
  "additionalProperties": false,
  "required": [
    "schema_version",
    "campaign_id",
    "manifest_fingerprint",
    "repository",
    "repository_commit",
    "branch",
    "frozen_preregistration_commit",
    "campaign_status",
    "level2_reference",
    "level3_s4_reference",
    "geometries"
  ],
  "properties": {
    "schema_version": {"const": "level3-s5-campaign-summary-v1"},
    "campaign_id": {"type": "string", "minLength": 1},
    "manifest_fingerprint": {"type": "string", "minLength": 1},
    "repository": {"const": "ioio2995/cosmobox"},
    "repository_commit": {"type": "string", "pattern": "^[0-9a-f]{40}$"},
    "branch": {"type": "string", "minLength": 1},
    "frozen_preregistration_commit": {"const": "496ba9484a6d7df9beb738607a5ffe23a75219ad"},
    "campaign_status": {
      "const": "COMPLETE",
      "description": "Always COMPLETE: an incomplete or failed campaign never produces this document at all."
    },
    "level2_reference": {
      "type": "object",
      "additionalProperties": false,
      "required": ["campaign_id", "manifest_fingerprint", "repository_commit", "frozen_preregistration_commit"],
      "properties": {
        "campaign_id": {"const": "level2-energy-regime-v1"},
        "manifest_fingerprint": {"const": "82dca9dee756f531375b31540b4f7d05c2c8ba1760150f2d9972f12a5da06fa4"},
        "repository_commit": {"const": "1feb03f41f9e73078efbc760dd2cba2b667e2ed0"},
        "frozen_preregistration_commit": {"const": "2d4c859db7939da51ee7d919889a18f4c7e229ed"}
      },
      "description": "Identifies without ambiguity which frozen Level2 campaign supplied the S=2/S=3 reference data."
    },
    "level3_s4_reference": {
      "type": "object",
      "additionalProperties": false,
      "required": ["campaign_id", "manifest_fingerprint", "repository_commit", "frozen_preregistration_commit"],
      "properties": {
        "campaign_id": {"const": "level3-s4-truncation-extension-v1"},
        "manifest_fingerprint": {"const": "3498677a4addc9c62c5e9c220cedb0dca135c9b293eee205420dcbce346d7cba"},
        "repository_commit": {"const": "ffb49da84111f778e45aa95b6d9e80b45d68f34c"},
        "frozen_preregistration_commit": {"const": "1c1d71f07dd6a7399b3965b2bb0acfa5c665991e"}
      },
      "description": "Identifies without ambiguity which frozen Level3 S4 campaign supplied the S=4 reference data."
    },
    "geometries": {
      "type": "array",
      "minItems": 3,
      "maxItems": 3,
      "items": {"$ref": "#/$defs/geometryS5Comparison"},
      "description": "Exactly triangle, ring4, ring5 -- no more, no fewer."
    }
  },
  "$defs": {
    "available": {
      "type": "object",
      "additionalProperties": false,
      "required": ["value", "reason"],
      "properties": {
        "value": {"type": ["number", "null"]},
        "reason": {"type": ["string", "null"]}
      },
      "description": "value is None if and only if reason is set."
    },
    "reversalCount": {
      "oneOf": [
        {"type": "integer", "minimum": 0, "maximum": 3},
        {"const": "NOT_EVALUABLE"}
      ],
      "description": "REVERSAL_COUNT_2345: 0, 1, 2, or 3 when all four directions (S2,S3,S4,S5) are resolved, else the literal string NOT_EVALUABLE. Descriptive only -- never a convergence criterion."
    },
    "primaryS4S5Comparison": {
      "type": "object",
      "additionalProperties": false,
      "required": [
        "metric",
        "delta_hl_s2", "delta_hl_s3", "delta_hl_s4", "delta_hl_s5",
        "direction_s2", "direction_s3", "direction_s4", "direction_s5",
        "primary_s4_s5_taxonomy",
        "reversal_count_2345",
        "t_x_34", "t_x_45", "r_delta_x_45_34",
        "c_x_34", "d_x_34", "c_x_45", "d_x_45", "r_d_x_45_34"
      ],
      "properties": {
        "metric": {"enum": ["M_TT", "R_eff"]},
        "delta_hl_s2": {"$ref": "#/$defs/available", "description": "Pinned from the frozen Level2 campaign-summary -- never recomputed."},
        "delta_hl_s3": {"$ref": "#/$defs/available", "description": "Pinned from the frozen Level2 campaign-summary -- never recomputed."},
        "delta_hl_s4": {"$ref": "#/$defs/available", "description": "Pinned from the frozen Level3 S4 campaign-summary -- never recomputed from a re-executed S4 case."},
        "delta_hl_s5": {"$ref": "#/$defs/available"},
        "direction_s2": {"enum": ["POSITIVE", "NEGATIVE", "NUMERICALLY_UNRESOLVED", null]},
        "direction_s3": {"enum": ["POSITIVE", "NEGATIVE", "NUMERICALLY_UNRESOLVED", null]},
        "direction_s4": {"enum": ["POSITIVE", "NEGATIVE", "NUMERICALLY_UNRESOLVED", null]},
        "direction_s5": {"enum": ["POSITIVE", "NEGATIVE", "NUMERICALLY_UNRESOLVED", null]},
        "primary_s4_s5_taxonomy": {
          "enum": ["S5_DIRECTION_PERSISTS", "S5_DIRECTION_REVERSES", "S5_CONTRAST_UNRESOLVED", "NOT_EVALUABLE"]
        },
        "reversal_count_2345": {"$ref": "#/$defs/reversalCount"},
        "t_x_34": {"$ref": "#/$defs/available", "description": "abs(delta_hl_s4 - delta_hl_s3), pinned from the frozen Level3 S4 campaign-summary."},
        "t_x_45": {"$ref": "#/$defs/available", "description": "abs(delta_hl_s5 - delta_hl_s4)."},
        "r_delta_x_45_34": {"$ref": "#/$defs/available", "description": "t_x_45 / t_x_34, only when t_x_34 > 0. No threshold associated."},
        "c_x_34": {"$ref": "#/$defs/available", "description": "Pinned from the frozen Level3 S4 campaign-summary."},
        "d_x_34": {"$ref": "#/$defs/available", "description": "Pinned from the frozen Level3 S4 campaign-summary."},
        "c_x_45": {"$ref": "#/$defs/available", "description": "Computed with the same profiles.cross_profile_correlation primitive as C_X_34, on the S4<->S5 pair."},
        "d_x_45": {"$ref": "#/$defs/available", "description": "Computed with the same profiles.cross_profile_distance primitive as D_X_34, on the S4<->S5 pair."},
        "r_d_x_45_34": {"$ref": "#/$defs/available", "description": "d_x_45 / d_x_34, only when d_x_34 > 0. No threshold associated."}
      },
      "description": "Mirrors the S4<->S5 primary comparison contract of docs/levels/level3/s5-second-extension-preregistration.md sections 8-10 exactly."
    },
    "controlS4S5Comparison": {
      "type": "object",
      "additionalProperties": false,
      "required": ["metric", "delta_hl_s2", "delta_hl_s3", "delta_hl_s4", "delta_hl_s5"],
      "properties": {
        "metric": {"enum": ["A_QQ", "M_QQ"]},
        "delta_hl_s2": {"$ref": "#/$defs/available"},
        "delta_hl_s3": {"$ref": "#/$defs/available"},
        "delta_hl_s4": {"$ref": "#/$defs/available"},
        "delta_hl_s5": {"$ref": "#/$defs/available"}
      },
      "description": "Deliberately has NO primary_s4_s5_taxonomy/reversal_count_2345/shape-descriptor property -- additionalProperties:false makes it a schema error to include one (control channel never creates or overrides a primary result)."
    },
    "geometryS5Comparison": {
      "type": "object",
      "additionalProperties": false,
      "required": ["geometry", "m_tt", "r_eff", "a_qq", "m_qq"],
      "properties": {
        "geometry": {"enum": ["triangle", "ring4", "ring5"]},
        "m_tt": {"allOf": [{"$ref": "#/$defs/primaryS4S5Comparison"}, {"properties": {"metric": {"const": "M_TT"}}}]},
        "r_eff": {"allOf": [{"$ref": "#/$defs/primaryS4S5Comparison"}, {"properties": {"metric": {"const": "R_eff"}}}]},
        "a_qq": {"allOf": [{"$ref": "#/$defs/controlS4S5Comparison"}, {"properties": {"metric": {"const": "A_QQ"}}}]},
        "m_qq": {"allOf": [{"$ref": "#/$defs/controlS4S5Comparison"}, {"properties": {"metric": {"const": "M_QQ"}}}]}
      }
    }
  }
}
