{
  "branch": "research/level2-energy-regime",
  "campaign_id": "level3-s5-truncation-extension-v1",
  "campaign_status": "COMPLETE",
  "frozen_preregistration_commit": "496ba9484a6d7df9beb738607a5ffe23a75219ad",
  "geometries": [
    {
      "a_qq": {
        "delta_hl_s2": {
          "reason": null,
          "value": 0.0
        },
        "delta_hl_s3": {
          "reason": null,
          "value": 0.03472222222222243
        },
        "delta_hl_s4": {
          "reason": null,
          "value": -0.026223776223776363
        },
        "delta_hl_s5": {
          "reason": null,
          "value": -0.021067415730337324
        },
        "metric": "A_QQ"
      },
      "geometry": "ring4",
      "m_qq": {
        "delta_hl_s2": {
          "reason": null,
          "value": 0.034741636495151496
        },
        "delta_hl_s3": {
          "reason": null,
          "value": 0.023097563037031532
        },
        "delta_hl_s4": {
          "reason": null,
          "value": 0.05155770008652544
        },
        "delta_hl_s5": {
          "reason": null,
          "value": 0.06041461015956956
        },
        "metric": "M_QQ"
      },
      "m_tt": {
        "c_x_34": {
          "reason": null,
          "value": 0.16408919181875126
        },
        "c_x_45": {
          "reason": null,
          "value": 0.1418302659119262
        },
        "d_x_34": {
          "reason": null,
          "value": 1.2931701092991155
        },
        "d_x_45": {
          "reason": null,
          "value": 1.3102829165639254
        },
        "delta_hl_s2": {
          "reason": null,
          "value": -0.007742838926974305
        },
        "delta_hl_s3": {
          "reason": null,
          "value": -0.005857982377896448
        },
        "delta_hl_s4": {
          "reason": null,
          "value": 0.02040937556731595
        },
        "delta_hl_s5": {
          "reason": null,
          "value": 0.024002328924935146
        },
        "direction_s2": "NEGATIVE",
        "direction_s3": "NEGATIVE",
        "direction_s4": "POSITIVE",
        "direction_s5": "POSITIVE",
        "metric": "M_TT",
        "primary_s4_s5_taxonomy": "S5_DIRECTION_PERSISTS",
        "r_d_x_45_34": {
          "reason": null,
          "value": 1.0132332220964224
        },
        "r_delta_x_45_34": {
          "reason": null,
          "value": 0.13678396453549913
        },
        "reversal_count_2345": 1,
        "t_x_34": {
          "reason": null,
          "value": 0.0262673579452124
        },
        "t_x_45": {
          "reason": null,
          "value": 0.003592953357619194
        }
      },
      "r_eff": {
        "c_x_34": {
          "reason": null,
          "value": 0.016829885066717454
        },
        "c_x_45": {
          "reason": null,
          "value": -0.07122414345616603
        },
        "d_x_34": {
          "reason": null,
          "value": 1.4024594656259024
        },
        "d_x_45": {
          "reason": null,
          "value": 1.463845908880112
        },
        "delta_hl_s2": {
          "reason": null,
          "value": -0.0020882959675153634
        },
        "delta_hl_s3": {
          "reason": null,
          "value": -0.0021358495740230188
        },
        "delta_hl_s4": {
          "reason": null,
          "value": -0.01456570479028163
        },
        "delta_hl_s5": {
          "reason": null,
          "value": -0.01809462533402406
        },
        "direction_s2": "NEGATIVE",
        "direction_s3": "NEGATIVE",
        "direction_s4": "NEGATIVE",
        "direction_s5": "NEGATIVE",
        "metric": "R_eff",
        "primary_s4_s5_taxonomy": "S5_DIRECTION_PERSISTS",
        "r_d_x_45_34": {
          "reason": null,
          "value": 1.043770565038622
        },
        "r_delta_x_45_34": {
          "reason": null,
          "value": 0.2839068100428475
        },
        "reversal_count_2345": 0,
        "t_x_34": {
          "reason": null,
          "value": 0.012429855216258612
        },
        "t_x_45": {
          "reason": null,
          "value": 0.003528920543742431
        }
      }
    },
    {
      "a_qq": {
        "delta_hl_s2": {
          "reason": null,
          "value": 0.015999999999999903
        },
        "delta_hl_s3": {
          "reason": null,
          "value": 0.01196808510638303
        },
        "delta_hl_s4": {
          "reason": null,
          "value": -0.008964143426294813
        },
        "delta_hl_s5": {
          "reason": null,
          "value": -0.0071656050955414274
        },
        "metric": "A_QQ"
      },
      "geometry": "ring5",
      "m_qq": {
        "delta_hl_s2": {
          "reason": null,
          "value": 0.020202352134593093
        },
        "delta_hl_s3": {
          "reason": null,
          "value": 0.046124103926328375
        },
        "delta_hl_s4": {
          "reason": null,
          "value": 0.07162742518780663
        },
        "delta_hl_s5": {
          "reason": null,
          "value": 0.08253733329086804
        },
        "metric": "M_QQ"
      },
      "m_tt": {
        "c_x_34": {
          "reason": null,
          "value": 0.2072550311235818
        },
        "c_x_45": {
          "reason": null,
          "value": 0.12409243866751105
        },
        "d_x_34": {
          "reason": null,
          "value": 1.2601083568784401
        },
        "d_x_45": {
          "reason": null,
          "value": 1.324021466098548
        },
        "delta_hl_s2": {
          "reason": null,
          "value": -0.005818691260019174
        },
        "delta_hl_s3": {
          "reason": null,
          "value": 0.004351133007983621
        },
        "delta_hl_s4": {
          "reason": null,
          "value": 0.015489274489672966
        },
        "delta_hl_s5": {
          "reason": null,
          "value": 0.0199306997477227
        },
        "direction_s2": "NEGATIVE",
        "direction_s3": "POSITIVE",
        "direction_s4": "POSITIVE",
        "direction_s5": "POSITIVE",
        "metric": "M_TT",
        "primary_s4_s5_taxonomy": "S5_DIRECTION_PERSISTS",
        "r_d_x_45_34": {
          "reason": null,
          "value": 1.0507203280346735
        },
        "r_delta_x_45_34": {
          "reason": null,
          "value": 0.3987582008498686
        },
        "reversal_count_2345": 1,
        "t_x_34": {
          "reason": null,
          "value": 0.011138141481689345
        },
        "t_x_45": {
          "reason": null,
          "value": 0.004441425258049733
        }
      },
      "r_eff": {
        "c_x_34": {
          "reason": null,
          "value": 0.12733646668305615
        },
        "c_x_45": {
          "reason": null,
          "value": 0.09894449125818931
        },
        "d_x_34": {
          "reason": null,
          "value": 1.323201628606669
        },
        "d_x_45": {
          "reason": null,
          "value": 1.3433027307177314
        },
        "delta_hl_s2": {
          "reason": null,
          "value": 0.002277479585917397
        },
        "delta_hl_s3": {
          "reason": null,
          "value": -0.009134320925960226
        },
        "delta_hl_s4": {
          "reason": null,
          "value": -0.018150290740480468
        },
        "delta_hl_s5": {
          "reason": null,
          "value": -0.022833426281724134
        },
        "direction_s2": "POSITIVE",
        "direction_s3": "NEGATIVE",
        "direction_s4": "NEGATIVE",
        "direction_s5": "NEGATIVE",
        "metric": "R_eff",
        "primary_s4_s5_taxonomy": "S5_DIRECTION_PERSISTS",
        "r_d_x_45_34": {
          "reason": null,
          "value": 1.015191261616137
        },
        "r_delta_x_45_34": {
          "reason": null,
          "value": 0.5194267103358603
        },
        "reversal_count_2345": 1,
        "t_x_34": {
          "reason": null,
          "value": 0.009015969814520242
        },
        "t_x_45": {
          "reason": null,
          "value": 0.004683135541243666
        }
      }
    },
    {
      "a_qq": {
        "delta_hl_s2": {
          "reason": null,
          "value": 3.3306690738754696e-16
        },
        "delta_hl_s3": {
          "reason": null,
          "value": 0.09375
        },
        "delta_hl_s4": {
          "reason": null,
          "value": -0.07142857142857129
        },
        "delta_hl_s5": {
          "reason": null,
          "value": -0.05769230769230782
        },
        "metric": "A_QQ"
      },
      "geometry": "triangle",
      "m_qq": {
        "delta_hl_s2": {
          "reason": null,
          "value": 0.0
        },
        "delta_hl_s3": {
          "reason": null,
          "value": 0.0
        },
        "delta_hl_s4": {
          "reason": null,
          "value": 1.1102230246251565e-16
        },
        "delta_hl_s5": {
          "reason": null,
          "value": 1.1879386363489175e-14
        },
        "metric": "M_QQ"
      },
      "m_tt": {
        "c_x_34": {
          "reason": null,
          "value": 0.13032852654691932
        },
        "c_x_45": {
          "reason": null,
          "value": 0.17866476604535575
        },
        "d_x_34": {
          "reason": null,
          "value": 1.3191358859946456
        },
        "d_x_45": {
          "reason": null,
          "value": 1.2818178864660208
        },
        "delta_hl_s2": {
          "reason": null,
          "value": -0.004126671615421296
        },
        "delta_hl_s3": {
          "reason": null,
          "value": -0.019478063957488134
        },
        "delta_hl_s4": {
          "reason": null,
          "value": 0.022367678417702555
        },
        "delta_hl_s5": {
          "reason": null,
          "value": 0.01497707126260038
        },
        "direction_s2": "NEGATIVE",
        "direction_s3": "NEGATIVE",
        "direction_s4": "POSITIVE",
        "direction_s5": "POSITIVE",
        "metric": "M_TT",
        "primary_s4_s5_taxonomy": "S5_DIRECTION_PERSISTS",
        "r_d_x_45_34": {